{
  "$schema": "https://json-schema.org/draft/2020-12/schema",
  "$id": "https://raw.githubusercontent.com/BourbonDog/amicus/main/schemas/council-verdict.schema.json",
  "title": "amicus council-verdict document",
  "description": "Verdict record (`council verdict --json`, amicus_verdict, verdict.json). overallVerdict is the chair's parsed terminal line — the VERDICT line on a review run, the ANSWER line on a task run (v4.9 W7) — null in every Stage-4 manual path, populated by the headless engine.",
  "type": "object",
  "required": [
    "schemaVersion",
    "type",
    "runId",
    "council",
    "overallVerdict",
    "findings",
    "streetCred",
    "runStats",
    "tierCounts"
  ],
  "properties": {
    "schemaVersion": {
      "const": 2
    },
    "type": {
      "const": "council-verdict"
    },
    "runId": {
      "type": "string"
    },
    "runType": {
      "type": [
        "string",
        "null"
      ]
    },
    "date": {
      "type": [
        "string",
        "null"
      ]
    },
    "chair": {
      "type": [
        "string",
        "null"
      ]
    },
    "council": {
      "type": "array",
      "items": {
        "type": "string"
      }
    },
    "seats": {
      "type": "array",
      "description": "v4.8, optional. The tally record's meta.seats promoted to the top level beside seatLoss — one {id, alias, role, lens, position} entry per BENCH seat in bench order. Present only when the tally record carried one, i.e. only when the bench repeated an alias. It is what makes the `alias#N` ids on findings[].raiserSeat, adjudications[].seat and runStats[].seat resolvable from the verdict ALONE. Bench-only: 'claude' is never a seat, so this must never be joined positionally to `council`. ABSENCE DOES NOT MEAN the bench had no repeated alias — it means no seat table is available; a verdict written before v4.8, or assembled by hand, has none. `items` is deliberately unconstrained: `council report` accepts any array here and falls back to alias space WHOLE unless every element is an object carrying a string `id`, rather than failing to render."
    },
    "claudeInCouncil": {
      "type": "boolean"
    },
    "intent": {
      "enum": ["review", "task"],
      "description": "v4.9, optional. The run's intent, forwarded from the tally record's meta.intent. The engine emits it only when 'task' — a review verdict never materializes the key, keeping review-run verdict.json byte-identical — but an explicit 'review' from hand-assembled input is accepted."
    },
    "overallVerdict": {
      "description": "v4.9 W7: the chair's parsed terminal line on EITHER scale — a review run's VERDICT phrase ('Ship it' | 'Fix these first' | 'Fundamental rethink') or a task run's ANSWER phrase ('Converged' | 'Split' | 'Insufficient'). The two scales are disjoint by construction, so the value alone identifies the intent; `intent` above states it explicitly on task runs.",
      "oneOf": [
        {
          "enum": [
            "Ship it",
            "Fix these first",
            "Fundamental rethink",
            "Converged",
            "Split",
            "Insufficient"
          ]
        },
        {
          "type": "null"
        }
      ]
    },
    "findings": {
      "type": "array",
      "items": {
        "type": "object",
        "required": [
          "id",
          "tier",
          "decision",
          "applied"
        ],
        "properties": {
          "id": {
            "type": "string"
          },
          "raiser": {
            "type": [
              "string",
              "null"
            ]
          },
          "severity": {
            "type": [
              "string",
              "null"
            ]
          },
          "tier": {
            "enum": [
              "Confirmed",
              "Contested",
              "Singleton",
              "Disputed"
            ]
          },
          "basis": {
            "type": "object"
          },
          "confidence": {
            "enum": [
              "thin",
              "solid"
            ]
          },
          "tierOverride": {
            "type": [
              "object",
              "null"
            ]
          },
          "duplicateOf": {
            "type": [
              "string",
              "null"
            ]
          },
          "adjudications": {
            "type": "array"
          },
          "raiserSeat": {
            "type": [
              "string",
              "null"
            ],
            "description": "v4.8, optional. The raising SEAT's id (e.g. 'deepseek#1'), carried through from the tally record. Emitted only when it differs from the raiser's alias, so a bench with no repeated alias never carries it; `raiser` stays the alias in every case. Resolve it against the top-level `seats` table. Before v4.8 the verdict named seats it could not resolve — a reader holding only the verdict could not tell which of two same-alias seats raised a finding."
          },
          "sameModelCorroboration": {
            "const": true,
            "description": "v4.8, optional, TRUE ONLY (never emitted as false, so a document without it is byte-identical to a pre-v4.8 one). Carried through from the tally record: after the seat-aware raiser exclusion, at least one AGREEING peer of this finding shares the raiser's alias — corroboration that is real but came from another seat of the same model, so it is not independent. WRONG IN BOTH DIRECTIONS, by construction: the comparison is on the ALIAS only. It MISSES one model reached under two aliases (e.g. --models gpt-5,openai/gpt-5), because votes carry no resolved-executable id. And it FIRES FALSELY on a SPLIT alias — one alias whose two seats resolved to different executables — telling a reader to discount a genuinely independent cross-executable corroboration. The reliability ledger keys identity on (alias, resolvedModel) for the same run, so the two documents can disagree about what 'the same model' means. Treat this as 'worth a second look', never as proof."
          },
          "decision": {
            "type": [
              "string",
              "null"
            ]
          },
          "applied": {
            "type": "boolean"
          },
          "debate": {
            "type": "object",
            "properties": {
              "action": {
                "enum": [
                  "defended",
                  "amended",
                  "withdrawn",
                  "no-response"
                ]
              },
              "previousTier": {
                "type": [
                  "string",
                  "null"
                ]
              }
            },
            "required": [
              "action"
            ],
            "additionalProperties": false
          }
        }
      }
    },
    "streetCred": {
      "type": "array",
      "items": {
        "type": "object"
      }
    },
    "runStats": {
      "type": "array",
      "items": {
        "type": "object"
      }
    },
    "tierCounts": {
      "type": "object"
    },
    "seatLoss": {
      "type": "object",
      "description": "Present only when --critic was requested. Records whether the adversarial seat actually reviewed: a dead critic wave is survivable (the quorum gate guards only the bench), so a run can otherwise reach a full verdict with the critic silently absent.",
      "properties": {
        "criticRequested": {
          "type": "string",
          "description": "The model asked for as critic."
        },
        "criticSeated": {
          "type": "boolean",
          "description": "False when the critic wave died before producing legs."
        },
        "reason": {
          "type": [
            "string",
            "null"
          ],
          "description": "Why the critic wave died, when it did."
        },
        "deadBenchSeats": {
          "type": "array",
          "items": {
            "type": "string"
          },
          "description": "Bench models lost to dead waves, excluding the critic."
        }
      },
      "required": [
        "criticRequested",
        "criticSeated"
      ]
    },
    "seatsReviewed": {
      "type": "object",
      "description": "#202, optional. How much of the BENCH actually reviewed, derived from runStats: `of` counts every BENCH-role row — `seat`, `critic`, or `lens:<slug>`, exactly the roles seats.js :: buildSeats mints (one per bench seat POST-retry, so a healed seat is counted once and its first attempt is `role:'superseded'`), and `reviewed` counts those whose leg completed. Judges, chair, repair, relaunch (#257 R-X45) and superseded rows are not bench seats and are excluded — the predicate is an ALLOWLIST of bench roles, so any role not named above is excluded by construction rather than by this list being kept current. EMIT-WHEN-SET: a record with no bench rows carries no key at all, because `0 of 0` would read as a measurement of an empty bench rather than as the absence it is. WHY IT EXISTS: the sibling `seatLoss` above is present only when --critic was requested, and CI runs none — so seat loss was structurally absent from every CI verdict while a two-seat bench published a four-model street-cred table whose dead seats rendered `n/a`, indistinguishable from the legend's neutral (MEASURED, run 4424218c). No `additionalProperties: false` at the top level of this schema means an additive field was always accepted here; this documents the shape rather than changing what is accepted. v4.9.8 (#242): `unverified` (bench seats among `reviewed` whose findings came from a repair of a response with no parseable findings block — runStats[].findingsUnverified) and, since council #248 round 2, `refused` (those whose repair was refused — runStats[].repairRefused) join the census. buildVerdict writes it whenever it writes the census, since that version (0 is a measurement); it is declared, not required, so documents written before it still validate.",
      "properties": {
        "reviewed": { "type": "integer", "minimum": 0, "description": "Bench seats whose leg completed." },
        "unverified": { "type": "integer", "minimum": 0, "description": "v4.9.8 (#242): bench seats, counted in `reviewed` too, whose findings came from a repair of a response with no parseable findings block — the tally scored those findings and nothing verified the repair. Not a stub count. A refused repair (runStats[].repairRefused) is not counted here. Never more than `reviewed`: the census and the report share one predicate (a bench role, a completed leg, the literal true), so a flagged row that is not a completed bench seat is counted nowhere and rendered nowhere." },
        "refused": { "type": "integer", "minimum": 0, "description": "v4.9.8 (#242; council #248 round 2): bench seats, counted in `reviewed` too, whose repair was refused (runStats[].repairRefused) — the repair broke its count contract, so the seat contributed NO findings; visible here because a seat that contributed nothing must not read as a full reviewer on the gate. Always written with the census since v4.9.8; never more than `reviewed` (the census and the report share one predicate)." },
        "of": { "type": "integer", "minimum": 1, "description": "Bench seats benched, post-retry." }
      },
      "required": ["reviewed", "of"],
      "additionalProperties": false
    },
    "degrades": {
      "description": "v4.6 Plan 2: what this run lost — copied verbatim from the sink at verdict assembly. Additive; absent when the sink recorded nothing. v4.9 widened kind with 'info': an announcement that is neither a loss nor a recovery (e.g. a task run's ledger-skipped note) — carried here without degrading the run.",
      "type": "array",
      "items": {
        "type": "object",
        "required": ["kind", "channel", "what", "why", "effect"],
        "properties": {
          "kind": { "enum": ["degrade", "heal", "info"] },
          "channel": { "type": "string" },
          "what": { "type": "string" },
          "why": { "type": "string" },
          "effect": { "type": "string" },
          "remedy": { "type": "string" },
          "data": {
            "type": "object",
            "description": "v4.6 Plan 2: optional structured facts for derivations (e.g. dead-leg {seat,status,reason}, dead-wave {waveId,models,reason}). Prose fields stay the human surface."
          }
        }
      }
    }
  }
}
