{
  "schemaVersion": 2,
  "type": "council-verdict",
  "runId": "aaaa1111",
  "runType": "headless",
  "date": "2026-07-18",
  "chair": "deepseek",
  "council": ["gemini", "gpt", "qwen"],
  "claudeInCouncil": false,
  "overallVerdict": "Fix these first",
  "findings": [
    { "id": "A1", "raiser": "gemini", "severity": "major", "tier": "Confirmed", "basis": { "a": 2, "d": 0, "n": 0 }, "confidence": "solid", "tierOverride": null, "duplicateOf": null,
      "adjudications": [ { "judge": "gpt", "verdict": "agree" }, { "judge": "qwen", "verdict": "agree" } ], "decision": "accept", "applied": true },
    { "id": "B1", "raiser": "gpt", "severity": "minor", "tier": "Disputed", "basis": { "a": 0, "d": 2, "n": 0 }, "confidence": "solid", "tierOverride": null, "duplicateOf": null,
      "adjudications": [ { "judge": "gemini", "verdict": "dispute" }, { "judge": "qwen", "verdict": "dispute" } ], "decision": null, "applied": false },
    { "id": "C1", "raiser": "qwen", "severity": "blocker", "tier": "Confirmed", "basis": { "a": 1, "d": 1, "n": 0 }, "confidence": "solid",
      "tierOverride": { "from": "Contested", "to": "Confirmed", "reason": "chair judgment" }, "duplicateOf": null,
      "adjudications": [ { "judge": "gemini", "verdict": "agree" }, { "judge": "gpt", "verdict": "dispute" } ], "decision": null, "applied": false },
    { "id": "C2", "raiser": "qwen", "severity": "nit", "tier": "Singleton", "basis": { "a": 0, "d": 0, "n": 2 }, "confidence": "thin", "tierOverride": null, "duplicateOf": null,
      "adjudications": [ { "judge": "gemini", "verdict": "neutral" }, { "judge": "gpt", "verdict": "neutral" } ], "decision": null, "applied": false }
  ],
  "streetCred": [
    { "model": "gemini", "withSelf": 1.0, "peersOnly": 1.0 },
    { "model": "gpt", "withSelf": 1.5, "peersOnly": 1.5 },
    { "model": "qwen", "withSelf": 2.0, "peersOnly": 2.0 }
  ],
  "runStats": [
    { "model": "gemini", "role": "seat", "wasChair": false, "conformance": "clean", "status": "complete", "durationMs": 120000, "usage": { "cost": { "amount": 0.11, "source": "reported" } } },
    { "model": "gpt", "role": "seat", "wasChair": false, "conformance": "repaired", "status": "complete", "durationMs": 130000, "usage": { "cost": { "amount": 0.13, "source": "reported" } } },
    { "model": "qwen", "role": "seat", "wasChair": false, "conformance": "clean", "status": "complete", "durationMs": 110000, "usage": { "cost": { "amount": 0.09, "source": "reported" } } },
    { "model": "deepseek", "role": "chair", "wasChair": true, "conformance": "clean", "status": "complete", "durationMs": 170000, "usage": { "cost": { "amount": 0.1, "source": "reported" } } }
  ],
  "tierCounts": { "Confirmed": 1, "Contested": 1, "Singleton": 1, "Disputed": 1 }
}
